{
  "schemaVersion": "1.0.0",
  "documentType": "activity_catalog",
  "catalogId": "smart_home_activity_catalog",
  "catalogVersion": "1.4.0",
  "components": [
    {
      "componentId": "carry_purchases",
      "description": "Semantic component 'carry_purchases' implemented at the project trace granularity by its ordered required actions.",
      "requiredActionTypes": [
        "take_item"
      ]
    },
    {
      "componentId": "carry_recycling",
      "description": "Semantic component 'carry_recycling' implemented at the project trace granularity by its ordered required actions.",
      "requiredActionTypes": [
        "take_item"
      ]
    },
    {
      "componentId": "change_clothes",
      "description": "Semantic component 'change_clothes' implemented at the project trace granularity by its ordered required actions.",
      "requiredActionTypes": [
        "take_item",
        "dress",
        "put_item"
      ]
    },
    {
      "componentId": "check_calendar",
      "description": "Semantic component 'check_calendar' implemented at the project trace granularity by its ordered required actions.",
      "requiredActionTypes": [
        "inspect"
      ]
    },
    {
      "componentId": "clean_surface",
      "description": "Semantic component 'clean_surface' implemented at the project trace granularity by its ordered required actions.",
      "requiredActionTypes": [
        "take_item",
        "clean",
        "put_item"
      ]
    },
    {
      "componentId": "collect_belongings",
      "description": "Semantic component 'collect_belongings' implemented at the project trace granularity by its ordered required actions.",
      "requiredActionTypes": [
        "take_item"
      ]
    },
    {
      "componentId": "collect_laundry",
      "description": "Semantic component 'collect_laundry' implemented at the project trace granularity by its ordered required actions.",
      "requiredActionTypes": [
        "laundry_step"
      ]
    },
    {
      "componentId": "collect_medication",
      "description": "Semantic component 'collect_medication' implemented at the project trace granularity by its ordered required actions.",
      "requiredActionTypes": [
        "manage_medication",
        "take_item"
      ]
    },
    {
      "componentId": "consume_drink",
      "description": "Semantic component 'consume_drink' implemented at the project trace granularity by its ordered required actions.",
      "requiredActionTypes": [
        "consume"
      ]
    },
    {
      "componentId": "consume_meal",
      "description": "Semantic component 'consume_meal' implemented at the project trace granularity by its ordered required actions.",
      "requiredActionTypes": [
        "change_posture",
        "consume",
        "change_posture"
      ]
    },
    {
      "componentId": "consume_snack",
      "description": "Semantic component 'consume_snack' implemented at the project trace granularity by its ordered required actions.",
      "requiredActionTypes": [
        "consume"
      ]
    },
    {
      "componentId": "discard_recycling",
      "description": "Semantic component 'discard_recycling' implemented at the project trace granularity by its ordered required actions.",
      "requiredActionTypes": [
        "put_item"
      ]
    },
    {
      "componentId": "dust",
      "description": "Semantic component 'dust' implemented at the project trace granularity by its ordered required actions.",
      "requiredActionTypes": [
        "take_item",
        "clean",
        "put_item"
      ]
    },
    {
      "componentId": "enter_home",
      "description": "Semantic component 'enter_home' implemented at the project trace granularity by its ordered required actions.",
      "requiredActionTypes": [
        "enter_home"
      ]
    },
    {
      "componentId": "exercise",
      "description": "Semantic component 'exercise' implemented at the project trace granularity by its ordered required actions.",
      "requiredActionTypes": [
        "exercise"
      ]
    },
    {
      "componentId": "hang_laundry",
      "description": "Semantic component 'hang_laundry' implemented at the project trace granularity by its ordered required actions.",
      "requiredActionTypes": [
        "laundry_step"
      ]
    },
    {
      "componentId": "inspect_supplies",
      "description": "Semantic component 'inspect_supplies' implemented at the project trace granularity by its ordered required actions.",
      "requiredActionTypes": [
        "open",
        "inspect",
        "close"
      ]
    },
    {
      "componentId": "iron_laundry",
      "description": "Semantic component 'iron_laundry' implemented at the project trace granularity by its ordered required actions.",
      "requiredActionTypes": [
        "laundry_step"
      ]
    },
    {
      "componentId": "leave_home",
      "description": "Semantic component 'leave_home' implemented at the project trace granularity by its ordered required actions.",
      "requiredActionTypes": [
        "leave_home"
      ]
    },
    {
      "componentId": "listen_radio",
      "description": "Semantic component 'listen_radio' implemented at the project trace granularity by its ordered required actions.",
      "requiredActionTypes": [
        "leisure"
      ]
    },
    {
      "componentId": "load_laundry",
      "description": "Semantic component 'load_laundry' implemented at the project trace granularity by its ordered required actions.",
      "requiredActionTypes": [
        "laundry_step"
      ]
    },
    {
      "componentId": "nap",
      "description": "Semantic component 'nap' implemented at the project trace granularity by its ordered required actions.",
      "requiredActionTypes": [
        "change_posture",
        "wait"
      ]
    },
    {
      "componentId": "organize_bag",
      "description": "Semantic component 'organize_bag' implemented at the project trace granularity by its ordered required actions.",
      "requiredActionTypes": [
        "organize"
      ]
    },
    {
      "componentId": "organize_clothes",
      "description": "Semantic component 'organize_clothes' implemented at the project trace granularity by its ordered required actions.",
      "requiredActionTypes": [
        "organize"
      ]
    },
    {
      "componentId": "organize_documents",
      "description": "Semantic component 'organize_documents' implemented at the project trace granularity by its ordered required actions.",
      "requiredActionTypes": [
        "organize"
      ]
    },
    {
      "componentId": "personal_hygiene",
      "description": "Semantic component 'personal_hygiene' implemented at the project trace granularity by its ordered required actions.",
      "requiredActionTypes": [
        "personal_care"
      ]
    },
    {
      "componentId": "phone_call",
      "description": "Semantic component 'phone_call' implemented at the project trace granularity by its ordered required actions.",
      "requiredActionTypes": [
        "change_posture",
        "communicate",
        "change_posture"
      ]
    },
    {
      "componentId": "portion_food",
      "description": "Semantic component 'portion_food' implemented at the project trace granularity by its ordered required actions.",
      "requiredActionTypes": [
        "organize"
      ]
    },
    {
      "componentId": "prepare_drink",
      "description": "Semantic component 'prepare_drink' implemented at the project trace granularity by its ordered required actions.",
      "requiredActionTypes": [
        "take_item",
        "activate",
        "prepare_food",
        "deactivate"
      ]
    },
    {
      "componentId": "prepare_food",
      "description": "Semantic component 'prepare_food' implemented at the project trace granularity by its ordered required actions.",
      "requiredActionTypes": [
        "open",
        "take_item",
        "close",
        "activate",
        "prepare_food",
        "deactivate",
        "put_item"
      ]
    },
    {
      "componentId": "prepare_salad",
      "description": "Semantic component 'prepare_salad' implemented at the project trace granularity by its ordered required actions.",
      "requiredActionTypes": [
        "take_item",
        "prepare_food",
        "put_item"
      ]
    },
    {
      "componentId": "read",
      "description": "Semantic component 'read' implemented at the project trace granularity by its ordered required actions.",
      "requiredActionTypes": [
        "change_posture",
        "leisure"
      ]
    },
    {
      "componentId": "read_in_bed",
      "description": "Semantic component 'read_in_bed' implemented at the project trace granularity by its ordered required actions.",
      "requiredActionTypes": [
        "change_posture",
        "leisure"
      ]
    },
    {
      "componentId": "read_news",
      "description": "Semantic component 'read_news' implemented at the project trace granularity by its ordered required actions.",
      "requiredActionTypes": [
        "leisure"
      ]
    },
    {
      "componentId": "reheat_food",
      "description": "Semantic component 'reheat_food' implemented at the project trace granularity by its ordered required actions.",
      "requiredActionTypes": [
        "take_item",
        "activate",
        "prepare_food",
        "deactivate"
      ]
    },
    {
      "componentId": "rest",
      "description": "Semantic component 'rest' implemented at the project trace granularity by its ordered required actions.",
      "requiredActionTypes": [
        "change_posture",
        "wait"
      ]
    },
    {
      "componentId": "return_to_bed",
      "description": "Semantic component 'return_to_bed' implemented at the project trace granularity by its ordered required actions.",
      "requiredActionTypes": [
        "change_posture"
      ]
    },
    {
      "componentId": "shop",